952eb980-aa3a-4f8d-bb92-e6150d5d550b,jkane,hello world,public
788a797e-7968-49e8-8a21-bcfce8a21005,jkane,where in the world is carmen san diego?,public
9554ea1b-854d-4f53-a716-f0d48f5f88dc,jkane,its never going to stop raining,public
dc8a5c21-e1d8-48d8-bd96-704721878283,ekane,Where is the nearest Little Caesars?,public
92a5754b-2554-4580-ae8d-ec5a86e66cc2,ekane,I hate when people don't use proper grammar or punctuation.,public
a5585ba6-8821-4e3d-8b37-d56bed8d8fd6,jkane,ekane,hey,private
6aecd395-badc-4b22-841f-16bf2bead368,jkane,ekane,hey,private
